uuid,alt_name,name,year_founded,url,search_term,reports_index
88,WASHINGTON UNIVERSITY,WASHINGTON UNIVERSITY,1923,http://law.wustl.edu/,WASHINGTON UNIVERSITY LAW ABA Standard 509 Employment Disclosures,
79,WAYNE STATE UNIVERSITY,WAYNE STATE,1937,http://www.law.wayne.edu/,WAYNE STATE LAW ABA Standard 509 Employment Disclosures,
161,WEST VIRGINIA UNIVERSITY,WEST VIRGINIA,1923,http://www.wvu.edu/~law/,WEST VIRGINIA LAW ABA Standard 509 Employment Disclosures,
75,WESTERN NEW ENGLAND UNIVERSITY,WESTERN NEW ENGLAND,1974,http://www1.law.wne.edu,WESTERN NEW ENGLAND LAW ABA Standard 509 Employment Disclosures,
188,WESTERN STATE COLLEGE OF LAW,WESTERN STATE,2005,http://www.wsulaw.edu/,WESTERN STATE LAW ABA Standard 509 Employment Disclosures,
167,WHITTIER LAW SCHOOL,WHITTIER,1978,http://www.law.whittier.edu/,WHITTIER LAW ABA Standard 509 Employment Disclosures,
179,WIDENER-COMMONWEALTH,WIDENER-COMMONWEALTH,1988,http://commonwealthlaw.widener.edu/,WIDENER-COMMONWEALTH LAW ABA Standard 509 Employment Disclosures,
26,WIDENER UNIVERSITY-DELAWARE,WIDENER-DELAWARE,1975,http://delawarelaw.widener.edu/,WIDENER-DELAWARE LAW ABA Standard 509 Employment Disclosures,
127,WILLAMETTE UNIVERSITY,WILLAMETTE,1938,http://www.willamette.edu/wucl,WILLAMETTE LAW ABA Standard 509 Employment Disclosures,
157,WILLIAM AND MARY LAW SCHOOL,WILLIAM AND MARY,1932,http://law.wm.edu,WILLIAM AND MARY LAW ABA Standard 509 Employment Disclosures,
162,"WISCONSIN, UNIVERSITY OF",WISCONSIN,1923,http://www.law.wisc.edu/,WISCONSIN LAW ABA Standard 509 Employment Disclosures,
164,"WYOMING, UNIVERSITY OF",WYOMING,1923,http://uwadmnweb.uwyo.edu/Law/,WYOMING LAW ABA Standard 509 Employment Disclosures,
25,YALE UNIVERSITY,YALE,1923,http://www.law.yale.edu/,YALE LAW ABA Standard 509 Employment Disclosures,